{
  "$schema": "http://json-schema.org/draft-07/schema#",
  "$id": "token.json",
  "title": "Token",
  "description": "An underlying token of a Yearn vault",
  "type": "object",
  "properties": {
    "name": {
      "type": "string"
    },
    "symbol": {
      "type": "string"
    },
    "description": {
      "type": "string"
    },
    "localization": {
      "type": "object",
      "properties": {
        "en": {
          "type": "object",
          "required": ["description"],
          "properties": { "description": { "type": "string" } }
        },
        "fr": {
          "type": "object",
          "required": ["description"],
          "properties": { "description": { "type": "string" } }
        },
        "es": {
          "type": "object",
          "required": ["description"],
          "properties": { "description": { "type": "string" } }
        },
        "de": {
          "type": "object",
          "required": ["description"],
          "properties": { "description": { "type": "string" } }
        },
        "pt": {
          "type": "object",
          "required": ["description"],
          "properties": { "description": { "type": "string" } }
        },
        "el": {
          "type": "object",
          "required": ["description"],
          "properties": { "description": { "type": "string" } }
        },
        "tr": {
          "type": "object",
          "required": ["description"],
          "properties": { "description": { "type": "string" } }
        },
        "vi": {
          "type": "object",
          "required": ["description"],
          "properties": { "description": { "type": "string" } }
        },
        "zh": {
          "type": "object",
          "required": ["description"],
          "properties": { "description": { "type": "string" } }
        },
        "hi": {
          "type": "object",
          "required": ["description"],
          "properties": { "description": { "type": "string" } }
        },
        "ja": {
          "type": "object",
          "required": ["description"],
          "properties": { "description": { "type": "string" } }
        },
        "id": {
          "type": "object",
          "required": ["description"],
          "properties": { "description": { "type": "string" } }
        },
        "ru": {
          "type": "object",
          "required": ["description"],
          "properties": { "description": { "type": "string" } }
        }
      },
      "required": [
        "en",
        "fr",
        "es",
        "de",
        "pt",
        "el",
        "tr",
        "vi",
        "zh",
        "hi",
        "ja",
        "id",
        "ru"
      ]
    },
    "categories": {
      "type": "array",
      "items": {
        "type": "string"
      }
    },
    "website": {
      "type": "string"
    }
  },
  "required": []
}
