{
  "$schema": "token",
  "name": "Curve yCRV Pool",
  "symbol": "yCRV-f",
  "description": "This token represents a Curve liquidity pool. Holders earn fees from users trading in the pool, and can also deposit the LP to Curve's gauges to earn CRV emissions. This crypto pool contains yCRV and CRV. CRV is Curve's governance token, and yCRV is Yearn's new liquid veCRV wrapper, redesigned from the ground up to give users 'the best CRV yields in DeFi'",
  "categories": ["Curve LP Tokens"],
  "website": "https://curve.fi/",
  "localization": {
    "en": {
      "description": "This token represents a Curve liquidity pool. Holders earn fees from users trading in the pool, and can also deposit the LP to Curve's gauges to earn CRV emissions. This crypto pool contains yCRV and CRV. CRV is Curve's governance token, and yCRV is Yearn's new liquid veCRV wrapper, redesigned from the ground up to give users 'the best CRV yields in DeFi'"
    },
    "fr": {
      "description": "This token represents a Curve liquidity pool. Holders earn fees from users trading in the pool, and can also deposit the LP to Curve's gauges to earn CRV emissions. This crypto pool contains yCRV and CRV. CRV is Curve's governance token, and yCRV is Yearn's new liquid veCRV wrapper, redesigned from the ground up to give users 'the best CRV yields in DeFi'"
    },
    "es": {
      "description": "This token represents a Curve liquidity pool. Holders earn fees from users trading in the pool, and can also deposit the LP to Curve's gauges to earn CRV emissions. This crypto pool contains yCRV and CRV. CRV is Curve's governance token, and yCRV is Yearn's new liquid veCRV wrapper, redesigned from the ground up to give users 'the best CRV yields in DeFi'"
    },
    "de": {
      "description": "This token represents a Curve liquidity pool. Holders earn fees from users trading in the pool, and can also deposit the LP to Curve's gauges to earn CRV emissions. This crypto pool contains yCRV and CRV. CRV is Curve's governance token, and yCRV is Yearn's new liquid veCRV wrapper, redesigned from the ground up to give users 'the best CRV yields in DeFi'"
    },
    "pt": {
      "description": "This token represents a Curve liquidity pool. Holders earn fees from users trading in the pool, and can also deposit the LP to Curve's gauges to earn CRV emissions. This crypto pool contains yCRV and CRV. CRV is Curve's governance token, and yCRV is Yearn's new liquid veCRV wrapper, redesigned from the ground up to give users 'the best CRV yields in DeFi'"
    },
    "el": {
      "description": "This token represents a Curve liquidity pool. Holders earn fees from users trading in the pool, and can also deposit the LP to Curve's gauges to earn CRV emissions. This crypto pool contains yCRV and CRV. CRV is Curve's governance token, and yCRV is Yearn's new liquid veCRV wrapper, redesigned from the ground up to give users 'the best CRV yields in DeFi'"
    },
    "tr": {
      "description": "This token represents a Curve liquidity pool. Holders earn fees from users trading in the pool, and can also deposit the LP to Curve's gauges to earn CRV emissions. This crypto pool contains yCRV and CRV. CRV is Curve's governance token, and yCRV is Yearn's new liquid veCRV wrapper, redesigned from the ground up to give users 'the best CRV yields in DeFi'"
    },
    "vi": {
      "description": "This token represents a Curve liquidity pool. Holders earn fees from users trading in the pool, and can also deposit the LP to Curve's gauges to earn CRV emissions. This crypto pool contains yCRV and CRV. CRV is Curve's governance token, and yCRV is Yearn's new liquid veCRV wrapper, redesigned from the ground up to give users 'the best CRV yields in DeFi'"
    },
    "zh": {
      "description": "This token represents a Curve liquidity pool. Holders earn fees from users trading in the pool, and can also deposit the LP to Curve's gauges to earn CRV emissions. This crypto pool contains yCRV and CRV. CRV is Curve's governance token, and yCRV is Yearn's new liquid veCRV wrapper, redesigned from the ground up to give users 'the best CRV yields in DeFi'"
    },
    "hi": {
      "description": "This token represents a Curve liquidity pool. Holders earn fees from users trading in the pool, and can also deposit the LP to Curve's gauges to earn CRV emissions. This crypto pool contains yCRV and CRV. CRV is Curve's governance token, and yCRV is Yearn's new liquid veCRV wrapper, redesigned from the ground up to give users 'the best CRV yields in DeFi'"
    },
    "ja": {
      "description": "This token represents a Curve liquidity pool. Holders earn fees from users trading in the pool, and can also deposit the LP to Curve's gauges to earn CRV emissions. This crypto pool contains yCRV and CRV. CRV is Curve's governance token, and yCRV is Yearn's new liquid veCRV wrapper, redesigned from the ground up to give users 'the best CRV yields in DeFi'"
    },
    "id": {
      "description": "This token represents a Curve liquidity pool. Holders earn fees from users trading in the pool, and can also deposit the LP to Curve's gauges to earn CRV emissions. This crypto pool contains yCRV and CRV. CRV is Curve's governance token, and yCRV is Yearn's new liquid veCRV wrapper, redesigned from the ground up to give users 'the best CRV yields in DeFi'"
    },
    "ru": {
      "description": "This token represents a Curve liquidity pool. Holders earn fees from users trading in the pool, and can also deposit the LP to Curve's gauges to earn CRV emissions. This crypto pool contains yCRV and CRV. CRV is Curve's governance token, and yCRV is Yearn's new liquid veCRV wrapper, redesigned from the ground up to give users 'the best CRV yields in DeFi'"
    }
  }
}
